{
  "artifact_class": "A-IN",
  "state": "raw",
  "language": "ru",
  "task": {
    "id": "TASK-1059",
    "title": "Одновременная обработка агентом до трёх контактов разных каналов",
    "requested_by": "Заказчик"
  },
  "products": [
    {
      "marker": "А",
      "product_class": "contact-center",
      "atomic_function": "автоматическое распределение обращений на агента",
      "profile": "P-SETTINGS",
      "owner": "владелец продукта КЦ"
    }
  ],
  "sources": [
    {
      "id": "SRC-01",
      "kind": "document",
      "locator": "mango_ba_prompts/runs/2026/RUN-0013/inputs/raw-requirement.md#расширенное-тз-заказчика-дословно",
      "content": "Реализация одновременной обработки до трех контактов агентом контакт-центра. Для каждого агента установить следующие лимиты: Голос 1, Чат 2, E-mail 1 фоновый, Всего контактов одновременно 3. Приоритет каналов: 1. Голосовой звонок 2. Чат 3. E-mail. При наличии свободной емкости система должна направлять контакт согласно приоритету. E-mail считается фоновым взаимодействием. При этом получение e-mail не должно переводить агента в статус \"Недоступен\". Критерии приемки: 1. Агент может одновременно работать с 3 контактами. 2. E-mail назначается как фоновое взаимодействие. 3. Голос имеет высший приоритет маршрутизации. 4. Чат имеет приоритет выше e-mail. 5. Система не назначает контакты сверх установленных лимитов. 6. Отчетность корректно отражает параллельную обработку. 7. Интерфейс позволяет переключаться между всеми активными взаимодействиями без потери контекста."
    }
  ]
}
